ID	Creators	Creator_Variants	Title	Title_Variants	Year	Sources
Pfau-2007-on_the_syntax_of	Pfau, Roland and Quer, Josep and Perniss, Pamela and Pfau, Roland and Steinbach, Markus	Pfau, Roland and Quer, Josep // Pfau, Roland and Quer, Josep and Perniss, Pamela and Pfau, Roland and Steinbach, Markus	On the syntax of negation and modals in German Sign Languages (DGS) and Catalan Sign Languages (LSC)	On the syntax of negation and modals in Catalan Sign Language and German Sign Language // On the syntax of negation and modals in German Sign Language (DGS) and Catalan Sign Language (LSC) // On the syntax of negation and modals in German Sign Languages (DGS) and Catalan Sign Languages (LSC)	2007	perniss-pfau-pfau-quer-steinbach_dgs-lsc2007 pfau-quer_dgs-lsc2007 pfau-quer_modals-catalan2007
Pfau-2007-the_grammar_of_headshake	Pfau, Roland and Quer, Josep		The grammar of headshake: A typological perspective on German Sign Language negation		2007	pfau-quer_headshake-typological2007
Pfeffer-1984-textkorpora_1_grunddeutsch_texte	Pfeffer, Alan and Lohnes, Walter F.W. and Ortmann, Wolf Dieter		Textkorpora 1. Grunddeutsch. Texte der gesprochenen deutschen Gegenwartssprache. Überregionale Umgangssprache aus der Bundesrepublik Deutschland, der DDR, Österreich und der Schweiz		1984	lohnes-ortmann-pfeffer_grunddeutsch-uberregionale1984
Pfeifer-1993-etymologisches_worterbuch_des_deutschen	Pfeifer, Wolfgang		Etymologisches Wörterbuch des Deutschen [Etymological dictionary of German]		1993	pfeifer_etymologisches-etymological1993
Pilch-1980-basel_german_a_challenge	Pilch, Herbert		Basel German: A Challenge to Phonemic Typology		1980	pilch_basel-challenge1980
Pittner-2004-where_syntax_and_semantics	Pittner, Karin and Austin, Jennifer R. and Engelberg, Stefan and Rauh, Gisa		Where syntax and semantics meet: adverbial positions in the German middle field		2004	austin-engelberg-pittner-rauh_meet-positions2004
Plank-2000-morphological_reactivation_and_phonological	Plank, Frans		Morphological re-activation and phonological alternations: Evidence for voiceless restructuring in German		2000	plank_activation-voiceless2000
Plank-2003-morphological_reactivation_and_phonological	Plank, Frans		Morphological re-activation and phonological alternations: Evidence for voiceless restructuring in German		2003	plank_activation-voiceless2003
Poeppel-1993-the_full_competence_hypothesis	Poeppel, David and Wexler, Ken		The full competence hypothesis of clause structure in early German		1993	poeppel-wexler_full-competence1993
Portner-2006-dependent_contexts_in_grammar	Portner, Paul		Dependent Contexts in Grammar and in Discourse: German Verb Movement from the Perspective of the Theory of Mood Selection		2006	portner_dependent-selection2006
Poschmann-2016-relative_clause_extraposition_and	Poschmann, Claudia and Wagner, Michael		Relative clause extraposition and prosody in German		2016	poschmann-wagner_extraposition-prosody2016
Proost-2007-conceptual_structure_in_lexical	Proost, Kristel		Conceptual Structure in Lexical Items. The lexicalisation of communication concepts in English, German and Dutch		2007	proost_items-lexicalisation2007
Pross-2019-what_about_lexical_semantics	Pross, Tillmann		What about lexical semantics if syntax is the only generative component of the grammar? A case study on word meaning in German		2019	pross_only-component2019
Rankin-2014-variational_learning_in_l2	Rankin, Tom		Variational learning in L2: the transfer of L1 syntax and parsing strategies in the interpretation of wh-questions by L1 German learners of L2 English		2014	rankin_variational-parsing2014
Rash-2019-chapter_6_metaphors_of	Rash, Felicity		Chapter 6. Metaphors of plant cultivation and flowing liquid in German colonialist discourse (1871–1914)		2019	rash_flowing-colonialist2019
Rathert-2000-morphophonology_of_the_past	Rathert, Monika and Zybatow, Lew N.		Morpho-phonology of the past participle in German: where is the place of ge-?		2000	rathert-zybatow_participle-ge2000
Rathmann-2003-the_optionality_of_agreement	Rathmann, Christian and Griffin, William E.		The optionality of agreement phrase: Evidence from German Sign Language (DGS)		2003	griffin-rathmann_optionality-dgs2003
Rauch-2008-the_phonologyparaphonology_interface_and	Rauch, Irmengard		The phonology/paraphonology interface and the sounds of German across time		2008	rauch_paraphonology-sounds2008
Reich-2008-from_discourse_to_odd	Reich, Ingo		From discourse to "odd coordinations": On asymmetric coordination and subject gaps in German		2008	reich_odd-coordinations2008
Reiffenstein-2004-althochdeutsche_grammatik_i_laut	Reiffenstein, Ingo and Braune, Wilhelm		Althochdeutsche Grammatik I: Laut- und Formlehre [Old High German grammar I: Phonology and morphology]		2004	braune-reiffenstein_althochdeutsche-formlehre2004
Reis-2005-on_the_syntax_of	Reis, Marga		On the syntax of so-called focus particles in German – A reply to Büring and Hartmann 2001		2005	reis_buring-hartmann2005
Render-1804-a_complete_analysis_or	Render, William		A complete analysis or grammar of the German language: or a philological and grammatical view of its construction, analogies, and various properties.		1804	render_philological-analogies1804
Resi-2011-the_position_of_relative	Resi, Rossella		The position of relative clauses in German		2011	resi_position-relative2011
Richter-1998-complementizers_and_finite_verbs	Richter, Franz and Sailer, Manfred		Complementizers and finite verbs in German sentence structure		1998	richter-sailer_complementizers-finite1998
Roehrs-2020-the_morphosyntax_of_phrasal	Roehrs, Dorian		The morpho-syntax of phrasal proper names in German		2020	roehrs_phrasal-proper2020
Roesch-2009-texas_alsatian_henri_castros	Roesch, Karen		Texas Alsatian: Henri Castro's Legacy		2009	roesch_alsatian-castros2009
Roesch-2012-language_maintenance_and_language	Roesch, Karen		Language maintenance and language death. The decline of Texas Alsatian		2012	roesch_texas-alsatian2012
Romero-2017-german_discourse_particles_in	Romero, Maribel		German discourse particles in questions		2017	romero_particles-questions2017
Ronneberger-Sibold-1998-phonological_simplification_vs_stylistic	Ronneberger-Sibold, Elke		Phonological simplification vs. stylistic differentiation in the history of German word stress		1998	ronneberger-sibold_simplification-differentiation1998
Ronneberger-Sibold-2012-blending_between_grammar_and	Ronneberger-Sibold, Elke		Blending between grammar and universal cognitive principles: Evidence from German, Farsi, and Chinese		2012	ronneberger-sibold_blending-farsi2012
Roturier-2006-an_investigation_into_the	Roturier, Johann		An Investigation into the Impact of Controlled English Rules on the Comprehensibility, Usefulness, and Acceptability of Machine-Translated Technical Documentation for French and German Users		2006	roturier_comprehensibility-usefulness2006
Rubba-1996-the_interaction_of_folk	Rubba, Johanna		The interaction of folk models and syntax: Case choice after prepositional verbs of cognition in German		1996	rubba_after-prepositional1996
Russ-1978-historical_german_phonology_and	Russ, Charles		Historical German Phonology and Morphology		1978	russ_historical-german1978
Russ-1982-studies_in_historical_german	Russ, Charles		Studies in Historical German Phonology. A Phonological Comparison of MHG and NHG with Reference to Modern Dialects.		1982	russ_mhg-nhg1982
Russ-1994-the_german_language_today	Russ, Charles V. J.		The German Language Today: A Linguistic Introduction		1994	russ_german-today1994
Russell-1985-a_gpsgrammar_for_german	Russell, Graham		A GPS-Grammar for German Word Order		1985	russell_gps-order1985
Rust,_Jr.,_Friedrich-1969-nama_worterbuch_kronlein_redivivus	Rust, Jr., Friedrich		Nama Wörterbuch (Krönlein Redivivus): J.G. Krönlein's Wortschatz der Khoi-Khoin		1969	rust_kronlein-redivivus1969 rust_kronlein-redivivus1969
Röhr-2011-decoding_information_status_by	Röhr, Christine and Baumann, Stefan		Decoding Information Status by Type and Position of Accent in German		2011	baumann-rohr_decoding-type2011
Salmons-1990-bilingual_discourse_marking_code	Salmons, Joe		Bilingual discourse marking: code switching, borrowing, and convergence in some German-American dialects		1990	salmons_borrowing-convergence1990
Salmons-1993-the_structure_of_the	Salmons, Joseph C.		The Structure of the Lexicon: Evidence from German Gender Assignment		1993	salmons_gender-assignment1993
Salzmann-2016-displaced_morphology_in_german	Salzmann, Martin and Barnickel, Katja and Naranjo, Matías Guzmán and Hein, Johannes and Korsah, Sampson and Murphy, Andrew and Paschen, Ludger and Puskar, Zorica and Zaleska, Joanna		Displaced morphology in German – Evidence for post-syntactic morphology		2016	barnickel-hein-korsah-murphy-naranjo-paschen-puskar-salzmann-zaleska_displaced-post2016
Salzmann-2017-reconstruction_and_resumption_in	Salzmann, M.		Reconstruction and resumption in indirect A′-dependencies: On the syntax of prolepsis and relativization in (Swiss) German and beyond		2017	salzmann_resumption-prolepsis2017
Salzmann-2019-displaced_morphology_in_german	Salzmann, Martin		Displaced morphology in German verb clusters. An argument for post-syntactic morphology		2019	salzmann_displaced-clusters2019
Sanchez-Stockhammer-2011-the_meaningfull_vocabulary_of	Sanchez-Stockhammer, Christina		The “meaning-full” vocabulary of English and German		2011	sanchez-stockhammer_meaning-full2011
Sauerland-1994-german_diathesis_and_verb	Sauerland, Uli		German diathesis and verb morphology		1994	sauerland_german-diathesis1994
Savela-2014-weighted_vowel_prototypes_in	Savela, Janne and Eerola, Osmo and Aaltonen, Olli		Weighted vowel prototypes in Finnish and German		2014	aaltonen-eerola-savela_weighted-prototypes2014
Sayer-1944-pidgin_english_a_text	Sayer, Edgar Sheppard		Pidgin English: a text book, history, and vocabulary of Pidgin English, for writers, travellers, students of the English language and philologists, also Anglo-Indian vocabulary		1944	sayer_travellers-philologists1944
Scheffler-2005-syntax_and_semantics_of	Scheffler, Tatjana		Syntax and semantics of causal denn in German		2005	scheffler_causal-denn2005
Schelletter-2001-negation_as_a_crosslinguistic	Schelletter, Christina		Negation as a Crosslinguistic Structure in a German-English Bilingual Child		2001	schelletter_crosslinguistic-child2001
Scherpenisse-1986-the_connection_between_base	Scherpenisse, Wim		The Connection Between Base Structure and Linearization Restrictions in German and Dutch		1986	scherpenisse_connection-linearization1986
Schiering-2009-from_documentation_to_grammatical	Schiering, René		From documentation to grammatical description: Prepositional phrases in Ruhrdeutsch		2009	schiering_prepositional-ruhrdeutsch2009
Schiller-2003-grammatical_feature_selection_in	Schiller, Niels O. and Caramazza, Alfonso		Grammatical feature selection in noun phrase production: Evidence from German and Dutch		2003	caramazza-schiller_feature-selection2003
Schleef-2009-a_crosscultural_comparison_of	Schleef, Erik		A cross-cultural comparison of the functions and sociolinguistic distribution of English and German tag questions and discourse markers in academic speech		2009	schleef_tag-academic2009
Schneider-2022-9_three_german_discourse	Schneider, Johannes		9. Three German discourse particles as speech act modifiers		2022	schneider_act-modifiers2022
Schröer-1907-grieb_chr_frs_dictionary	Schröer, Arnold		Grieb, Chr. Fr.'s dictionary of the English and German languages: Re-arranged, revised, and enlarged with special regard to pronunciation and etymology. Volume 2: German and English		1907	schroer_grieb-chr1907
Schubö-2020-phonetic_content_and_phonological	Schubö, Fabian and Zerbian, Sabine		Phonetic content and phonological structure affect pre-boundary lengthening in German		2020	schubo-zerbian_affect-lengthening2020
Schuhmacher-1986-verben_in_feldern_valenzworterbuch	Schuhmacher, Helmut		Verben in Feldern: Valenzwörterbuch zur Syntax und Semantik deutscher Verben		1986	schuhmacher_feldern-valenzworterbuch1986
Schulte_im_Walde-2002-a_subcategorisation_lexicon_for	Schulte im Walde, Sabine		A Subcategorisation Lexicon for German Verbs induced from a Lexicalised PCFG		2002	im_subcategorisation-pcfg2002
Schulte_im_Walde-2004-identification_quantitative_description_and	Schulte im Walde, Sabine		Identification, Quantitative Description, and Preliminary Distributional Analysis of German Particle Verbs		2004	im_quantitative-distributional2004
Schumacher-1986-verben_in_feldern_valenzworterbuch	Schumacher, Helmut		Verben in Feldern. Valenzwörterbuch zur Syntax und Semantik deutscher Verben		1986	schumacher_feldern-valenzworterbuch1986
Schumacher-2004-valbu__valenzworterbuch_deutscher	Schumacher, Helmut and Kubczak, Jacqueline and Schmidt, Renate and Ruiter, Vera de		VALBU – Valenzwörterbuch deutscher Verben [Valency dictionary for German verbs]		2004	kubczak-ruiter-schmidt-schumacher_valbu-valenzworterbuch2004
Schwabe-1842-the_englishmans_first_german	Schwabe, Ludwig		The Englishman's first German book, containing a guide to spelling and pronunciation, a progressive reader, and a concise grammar, arranged on an entirely new plan, calculated to facilitate the progress of the student		1842	schwabe_englishmans-calculated1842
Schwarz-2020-chapter_5_reduction_and	Schwarz, Christian		Chapter 5. Reduction and persistence of phonological dialect features in German		2020	schwarz_reduction-persistence2020
Schäfer-2005-german_adverbial_adjectives_syntactic	Schäfer, Martin		German adverbial adjectives: syntactic position and semantic interpretation		2005	schafer_adverbial-adjectives2005
Schäfer-2013-positions_and_interpretations_german	Schäfer, Martin		Positions and Interpretations. German Adverbial Adjectives at the Syntax-Semantics Interface		2013	schafer_positions-interpretations2013
Schäfer-2016-punctuation_and_syntactic_structure	Schäfer, Roland and Sayatz, Ulrike		Punctuation and syntactic structure in obwohl and weil clauses in nonstandard written German		2016	sayatz-schafer_obwohl-nonstandard2016
Schönenberger-2001-embedded_vtoc_in_child	Schönenberger, Manuela		Embedded V-to-C in child grammar: the acquisition of verb placement in Swiss German		2001	schonenberger_embedded-swiss2001
Schönpflug-2000-wordfragment_completions_in_the	Schönpflug, Ute		Word-fragment completions in the second (German) and third (English) language: A contribution to the organization of the trilingual speaker’s lexicon		2000	schonpflug_completions-trilingual2000
Scott-2014-the_genitive_phrase_in	Scott, Alan K		The genitive phrase in Dutch and German. A study of morphosyntactic change in codified languages		2014	scott_genitive-codified2014
Shannon-1992-toward_an_adequate_characterization	Shannon, Thomas F.		Toward an adequate characterization of relative clause extraposition in modern German		1992	shannon_adequate-characterization1992
Shaw-2001-synchronic_comparative_phonology_of	Shaw, Rameswar		Synchronic comparative phonology of Bengali and German		2001	shaw_synchronic-bengali2001 shaw_synchronic-bengali2001
Shores-1971-a_descriptive_syntax_of	Shores, David L.		A Descriptive Syntax of the Peterborough Chronicle from 1122-1154		1971	shores_peterborough-chronicle1971
Siebenhaar-2012-methodological_reflections_on_the	Siebenhaar, Beat and Leemann, Adrian		Methodological reflections on the phonetic– phonological continuum, illustrated on the prosody of Swiss German dialects		2012	leemann-siebenhaar_illustrated-swiss2012
Siebenhaar-2014-phonological_and_phonetic_considerations	Siebenhaar, Beat		Phonological and phonetic considerations for a classification of Swiss German dialects as a word language or a syllable language		2014	siebenhaar_considerations-swiss2014
Siepmann-1897-a_public_school_german	Siepmann, Otto		A public school German primer, comprising a first reader, grammar and exercises with some remarks on German pronunciation and full vocabularies		1897	siepmann_comprising-full1897
Sippel-2015-teacher_vs_peer_oral	Sippel, Lieselotte and Jackson, Carrie N.		Teacher vs. peer oral corrective feedback in the German language classroom		2015	jackson-sippel_peer-corrective2015
Smolka-2009-when_semantics_means_less	Smolka, Eva and Komlosi, Sarolta and Rösler, Frank		When Semantics means less than Morphology: The Processing of German Prefixed Verbs		2009	komlosi-rosler-smolka_less-prefixed2009
Smolka-2014-verstehen_understand_primes_stehen	Smolka, Eva and Preller, Katrin H. and Eulitz, Carsten		‘Verstehen’ (‘understand’) primes ‘stehen’ (‘stand’): Morphological structure overrides semantic compositionality in the lexical representation of German complex verbs		2014	eulitz-preller-smolka_stehen-overrides2014
Smolka-2019-when_morphological_structure_overrides	Smolka, Eva and Libben, Gary and Dressler, Wolfgang U.		When Morphological Structure Overrides Meaning: Evidence from German Prefix and Particle Verbs		2019	dressler-libben-smolka_overrides-prefix2019
Snell-Hornby-1984-the_linguistic_structure_of	Snell-Hornby, Mary		The linguistic structure of public directives in German and English		1984	snell-hornby_public-directives1984
Soames-1891-an_introduction_to_phonetics	Soames, Laura		An introduction to phonetics (English, French and German) with reading lessons and exercises		1891	soames_lessons-exercises1891
Sondrup-2004-aspects_of_german_romantic	Sondrup, Steven P.		Aspects of German Romantic Musical Discourse		2004	sondrup_romantic-musical2004
Speyer-2010-filling_the_german_vorfeld	Speyer, Augustin		Filling the German vorfeld in written and spoken discourse		2010	speyer_filling-vorfeld2010
Speyer-2014-the_coding_of_discourse	Speyer, Augustin and Fetzer, Anita		The coding of discourse relations in English and German argumentative discourse		2014	fetzer-speyer_coding-argumentative2014
Speyer-2022-discourse_relations_and_the	Speyer, Augustin		Discourse relations and the German prefield		2022	speyer_relations-prefield2022
Späth-2008-semantic_contributions_of_the	Späth, Andreas		Semantic Contributions of the Left Periphery to Discourse Linking: The Case of Topics in the Prefield and Middlefield in German		2008	spath_prefield-middlefield2008
Standwell-1973-on_german_segmental_phonemes	Standwell, Graham J.		On German segmental phonemes		1973	standwell_segmental-phonemes1973
Steensig-2005-notes_on_disaligning_yes	Steensig, Jakob and Asmuß, Birte		Notes on disaligning ‘yes but’ initiated utterances in Danish and German conversations		2005	asmuss-steensig_disaligning-initiated2005
Stein-2013-a_usage_dictionary_englishgerman	Stein, Gabriele		A Usage Dictionary English-German / German-English - Gebrauchswörterbuch Englisch-Deutsch / Deutsch-Englisch		2013	stein_gebrauchsworterbuch-englisch2013
Steinbach-2002-middle_voice_a_comparative	Steinbach, Markus		Middle Voice. A comparative study in the syntax-semantics interface of German		2002	steinbach_voice-interface2002
Steinbauer-1969-concise_dictionary_of_new	Steinbauer, Friedrich		Concise dictionary of New Guinea Pidgin (Neo-Melanesian) with translations in English and German		1969	steinbauer_concise-melanesian1969 steinbauer_concise-melanesian1969
Steiner-2001-translations_englishgerman_investigating_the	Steiner, Erich		Translations English–German: Investigating the relative importance of systemic contrasts and of the text-type “translation”		2001	steiner_importance-systemic2001
Steiner-2004-3_metafunctional_profile_of	Steiner, Erich and Teich, Elke		3. Metafunctional profile of the grammar of German		2004	steiner-teich_metafunctional-profile2004
Steiner-2022-variation_and_change_in	Steiner, Carina and Jeszenszky, Péter and Leemann, Adrian		Variation and change in Swiss German agreement morphology: Effects of social networks, language contact, and attitudes		2022	jeszenszky-leemann-steiner_swiss-networks2022
Steinitz-1969-adverbialsyntax	Steinitz, Renate		Adverbial-syntax		1969	steinitz_adverbial-syntax1969
Stern-1961-essential_german_grammar	Stern, Guy and Bleiler, Everett F.		Essential German grammar		1961	bleiler-stern_essential-german1961
Sternefeld-2009-syntax_eine_morphologisch_motivierte	Sternefeld, Wolfgang		Syntax: Eine morphologisch motivierte generative Beschreibung des Deutschen [Syntax: A morphologically motivated generative description of German]		2009	sternefeld_morphologisch-motivierteii2009
Sternefeld-2015-syntax_eine_morphologisch_motivierte	Sternefeld, Wolfgang		Syntax: Eine morphologisch motivierte generative Beschreibung des Deutschen [Syntax: A morphologically motivated generative description of German]		2015	sternefeld_morphologisch-motiviertei2015
Steube-2006-the_influence_of_operators	Steube, Anita and Molnár, Valéria and Winkler, Susanne	Steube, Anita // Steube, Anita and Molnár, Valéria and Winkler, Susanne	The influence of operators on the interpretation of DPs and PPs in German information structure		2006	molnar-steube-winkler_operators-pps2006 steube_operators-pps2006
Stevenson-1997-the_germanspeaking_world_a	Stevenson, Patrick		The German-Speaking World: A Practical Introduction to Sociolinguistic Issues		1997	stevenson_practical-issues1997
Stibbard-2000-is_discourse_intonation_applicable	Stibbard, Richard		Is discourse Intonation applicable to German? Evidence from politicians’ speeches in the Bundestag and from a television news broadcast		2000	stibbard_applicable-bundestag2000
Stielau-1980-nataler_deutsch_eine_dokumentation	Stielau, Hildegard Irma		Nataler Deutsch: Eine Dokumentation unter besonderer Berücksichtigung des englischen und afrikaansen Einflusses auf die deutsche Sprache in Natal		1980	stielau_nataler-afrikaansen1980
Stolterfoht-2004-focus_structure_and_the	Stolterfoht, Britta and Bader, Markus		Focus Structure and the Processing of Word Order Variations in German		2004	bader-stolterfoht_processing-variations2004
Stopp-1957-a_manual_of_modern	Stopp, Frederick John		A manual of modern German		1957	stopp_manual-modern1957
Strauss-1856-a_grammar_of_the	Strauss, G. L.		A grammar of the German language adapted for the use of English students, and from Heyse's theoretical and practical German grammar		1856	strauss_adapted-heyses1856
Strauss-1982-lexicalist_phonology_of_english	Strauss, Steven L.		Lexicalist phonology of English and German		1982	strauss_lexicalist-german1982
Streadbeck-1974-phrase_structure_rules_for	Streadbeck, Arval L. and Grimshaw, Michael N.		Phrase Structure Rules For German		1974	grimshaw-streadbeck_phrase-rules1974
Strecker-1997-grammatik_der_deutschen_sprache	Strecker, Bruno and Hoffmann, Ludger and Zifonun, Gisela		Grammatik der deutschen Sprache		1997	hoffmann-strecker-zifonun_grammatik-deutschen1997
Struckmeier-2017-against_information_structure_heads	Struckmeier, Volker		Against information structure heads: A relational analysis of German scrambling		2017	struckmeier_heads-relational2017
Störzer-2018-is_german_discourseconfigurational_experimental	Störzer, Melanie and Stolterfoht, Britta		Is German discourse-configurational? Experimental evidence for a topic position		2018	stolterfoht-storzer_configurational-experimental2018
Suchsland-1993-the_structure_of_german	Suchsland, Peter		The Structure of German Verb Projections — A Problem of Syntactic Parametrization		1993	suchsland_projections-parametrization1993
Sudhoff-2010-focus_particles_in_german	Sudhoff, Stefan		Focus Particles in German. Syntax, prosody, and information structure		2010	sudhoff_particles-prosody2010
Szagun-2006-development_of_vocabulary_and	Szagun, Gisela and Steinbrink, Claudia and Franik, Melanie and Stumper, Barbara		Development of vocabulary and grammar in young German-speaking children assessed with a German language development inventory		2006	franik-steinbrink-stumper-szagun_assessed-inventory2006
Szagun-2007-the_acquisition_of_gender	Szagun, Gisela and Stumper, Barbara and Sondag, Nina and Franik, Melanie		The acquisition of gender marking by young German-speaking children: Evidence for learning guided by phonological regularities		2007	franik-sondag-stumper-szagun_guided-regularities2007
Szczepaniak-2010-jespersens_cycle_in_german	Szczepaniak, Renata		Jespersen’s Cycle in German from the phonological perspective of syllable and word languages		2010	szczepaniak_jespersens-cycle2010
Szczepaniak-2014-vowel_and_consonant_epentheses	Szczepaniak, Renata		Vowel and consonant epentheses in the history of German from the typological perspective of syllable and word languages		2014	szczepaniak_consonant-epentheses2014
Talibov-2007-buduchskij_jazyk	Talibov, Bukar B.		Buduchskij jazyk		2007	talibov_buduchskij-jazyk2007 talibov_buduchskij-jazyk2007
Tawfig-1921-turkceden_almancaya_lugat_kitabi	Tawfig, Haggi G.		Türkceden Almancaya lugat kitabi = Türkisch-deutsches Wörterbuch		1921	tawfig_turkceden-almancaya1921 tawfig_turkceden-almancaya1921
Terborg-1993-elaboration_of_the_modal	Terborg, Heiner		Elaboration of the Modal Lexicon in German as a Second Language		1993	terborg_elaboration-modal1993
Thiele-1991-contrastive_aspects_of_a	Thiele, Wolfgang and Graustein, Gottfried		Contrastive aspects of a text analysis in English and German		1991	graustein-thiele_contrastive-text1991
Thiersch-1978-topics_in_german_syntax	Thiersch, Craig L		Topics in German syntax		1978	thiersch_topics-german1978
Tracy-1986-the_acquisition_of_case	Tracy, Rosemarie		The acquisition of case morphology in German		1986	tracy_acquisition-german1986
Trommer-2021-the_subsegmental_structure_of	Trommer, Jochen		The subsegmental structure of German plural allomorphy		2021	trommer_subsegmental-allomorphy2021
Trotzke-2017-german_grammar_and_mirativity	Trotzke, Andreas		German grammar and mirativity: Experimental evidence		2017	trotzke_mirativity-experimental2017
Trotzke-2020-german_discourse_particles_in	Trotzke, Andreas and Bidese, Ermenegildo and Moroni, Manuela Caterina		German discourse particles in the second language classroom		2020	bidese-moroni-trotzke_particles-classroom2020
