ID	Creators	Creator_Variants	Title	Title_Variants	Year	Sources
Donaldson-2006-german_an_essential_grammar	Bruce C. Donaldson		German: An essential grammar		2006	donaldson_german-essential2006
Donaldson-2007-german_an_essential_grammar	Donaldson, Bruce		German: An Essential Grammar		2007	donaldson_german-essential2007
Donhauser-2007-the_mouton_interactive_introduction	Donhauser, Karin and Fischer, Anette and Mecklenburg, Lars		The Mouton interactive introduction to historical linguistics of German: in deutsch und englisch		2007	donhauser-fischer-mecklenburg_mouton-englisch2007
Dressler-1998-bloomer_robert_1994_systemcongruity	Dressler, Wolfgang U.		Bloomer, Robert. 1994. System-Congruity and the Participles of Modern German and Modern English: A Study in Natural Morphology		1998	dressler_bloomer-congruity1998
Durrell-1996-hammers_german_grammar_and	Durrell, Martin		Hammer's German Grammar and Usage		1996	durrell_hammers-usage1996
Durrell-2002-hammers_german_grammar_and	Martin Durrell		Hammer's German Grammar and Usage		2002	durrell_hammers-usage2002
Durrell-2021-hammers_german_grammar_and	Durrell, Martin and Hammer, A. E		Hammer’s German Grammar and Usage		2021	durrell-hammer_hammers-usage2021
Dürscheid-2002-klaus_welke_deutsche_syntax	Dürscheid, Christa		Klaus Welke: Deutsche Syntax funktional. Perspektiviertheit syntaktischer Strukturen		2002	durscheid_welke-perspektiviertheit2002
Ebling-2015-factors_to_consider_when	Ebling, Sarah and Konrad, Reiner and Braem, Penny Boyes and Langer, Gabriele		Factors to consider when making lexical comparisons of sign languages: Notes from an ongoing comparison of German Sign Language and Swiss German Sign Language		2015	braem-ebling-konrad-langer_consider-ongoing2015
Ebobissé-1988-les_verbaux_du_dangaleat	Ebobissé, Carl		Les verbaux du Dangaléat de l'Est (Guéra, Tchad): lexique francais-dangaléat et allemand-dangaléat		1988	ebobisse_dangaleat-allemand1988 ebobisse_dangaleat-allemand1988
Ehrich-2000-sortale_bedeutung_und_argumentstruktur	Ehrich, Veronika and Rapp, Irene		Sortale Bedeutung und Argumentstruktur: ung-Nominalisierungen im Deutschen [Sortal meaning and argument structure: ung-nominalizations in German]		2000	ehrich-rapp_sortale-nominalisierungen2000
Eichhorn-1854-the_practical_german_grammar	Eichhorn, Charles		The practical German grammar; or, a natural method of learning to read, write, and speak the German language		1854	eichhorn_write-speak1854
Eikel-1954-new_braunfels_texas_german	Eikel, Fred		New Braunfels Texas German		1954	eikel_braunfels-texas1954
Eisenberg-1983-writing_system_and_morphology	Eisenberg, Peter		Writing system and morphology. Some orthographic regularities of German		1983	eisenberg_orthographic-regularities1983
Eisman-2014-heidrun_hegewald_and_the	Eisman, April A.		Heidrun Hegewald and the Cold War Politics of the Family in East German Painting		2014	eisman_heidrun-hegewald2014
Elgersma-1999-optimality_theory_and_natural	Elgersma, Diana		Optimality Theory and Natural Morphology: An Analysis of German Plural Formation*		1999	elgersma_optimality-formation1999
Ellert-2013-information_structure_affects_the	Ellert, Miriam		Information structure affects the resolution of the subject pronouns er and der in spoken German discourse		2013	ellert_affects-er2013
Elsner-2015-adverbial_morphology_in_german	Elsner, Daniela		Adverbial morphology in German		2015	elsner_adverbial-german2015
Emonds-2007-discovering_syntax_clause_structures	Emonds, Joseph E.		Discovering Syntax. Clause Structures of English, German and Romance		2007	emonds_discovering-romance2007
Engel-1977-syntax_der_deutschen_gegenwartssprache	Engel, Ulrich		Syntax der deutschen Gegenwartssprache		1977	engel_deutschen-gegenwartssprache1977
Engel-1994-syntax_der_deutschen_gegenwartssprache	Engel, Ulrich		Syntax der deutschen Gegenwartssprache		1994	engel_deutschen-gegenwartssprache1994
Engel-2009-syntax_der_deutschen_gegenwartssprache	Engel, Ulrich		Syntax der deutschen Gegenwartssprache		2009	engel_deutschen-gegenwartssprache2009
Eppler-2010-emigranto_the_syntax_of	Eppler, Eva Duran		Emigranto: The Syntax of German-English Code-Switching		2010	eppler_emigranto-switching2010
Evert-2017-the_impact_of_translation	Evert, Stefan and Neumann, Stella		The impact of translation direction on characteristics of translated texts : A multivariate analysis for English and German		2017	evert-neumann_direction-multivariate2017
Fagan-1992-the_syntax_and_semantics	Fagan, Sarah		The syntax and semantics of middle constructions: A study with special reference to German		1992	fagan_middle-special1992
Fagan-2009-german_a_linguistic_introduction	Fagan, Sarah M. B.		German: A linguistic introduction		2009	fagan_german-introduction2009
Falk-2011-object_pronouns_in_german	Falk, Yehuda and Bardel, Camilla		Object pronouns in German L3 syntax. Evidence for the L2 status factor		2011	bardel-falk_l3-factor2011
Fanselow-2004-cyclic_phonologysyntax_interaction_movement	Fanselow, Gisbert		Cyclic Phonology-syntax interaction. Movement to First Position in German		2004	fanselow_cyclic-position2004
Fanselow-2004-cyclic_phonologysyntaxinteraction_ppt_movement	Fanselow, Gisbert		Cyclic Phonology-Syntax-Interaction: PPT Movement in German (and Other Languages)		2004	fanselow_cyclic-ppt2004
Farasyn-2018-the_interplay_between_genre	Farasyn, Melissa and Walkden, George and Watts, Sheila and Breitbarth, Anne		The interplay between genre variation and syntax in a historical Low German corpus		2018	breitbarth-farasyn-walkden-watts_interplay-low2018
Featherston-2005-magnitude_estimation_and_what	Featherston, Sam		Magnitude estimation and what it can do for your syntax: Some wh-constraints in German		2005	featherston_magnitude-estimation2005
Fehrmann-2013-exploiting_space_in_german	Fehrmann, Gisela		Exploiting space in German Sign Language. Linguistic and topographic reference in signed discourse		2013	fehrmann_exploiting-topographic2013
Fetzer-2012-discourse_relations_in_english	Fetzer, Anita and Speyer, Augustin		Discourse relations in English and German discourse: Local and not-so-local constraints		2012	fetzer-speyer_local-so2012
Finkbeiner-2015-the_grammar_and_pragmatics	Finkbeiner, Rita		The grammar and pragmatics of N hin, N her (‘N thither, N hither’) in German		2015	finkbeiner_thither-hither2015
Follen-1828-practical_grammar_of_the	Follen, Charles		Practical Grammar of the German Language		1828	follen_practical-german1828
Fox-1984-german_intonation_an_outline	Fox, Anthony		German intonation: An outline		1984	fox_intonation-outline1984
Fox-2005-the_structure_of_german	Fox, Anthony		The structure of German		2005	fox_structure-german2005
Freiwald-2023-theme_in_english_and	Freiwald, Jonas		Theme in English and German. A corpus-based contrastive analysis of clause openings in original and translated texts		2023	freiwald_openings-original2023
Frey-2004-a_medial_topic_position	Frey, Werner		A medial topic position for German		2004	frey_medial-topic2004
Frey-2004-notes_on_the_syntax	Frey, Werner		Notes on the syntax and the pragmatics of German Left Dislocation		2004	frey_left-dislocation2004
Frey-2004-the_grammarpragmatics_interface_and	Frey, Werner		The grammar-pragmatics interface and the German prefield		2004	frey_interface-prefield2004
Fritz-1992-remarks_on_the_structure	Fritz, Gerd		Remarks on the Structure of the Verbal Complex in Early 17th Century German		1992	fritz_remarks-complex1992
Fuhrhop-2011-the_interaction_between_morphology	Fuhrhop, Nanna		The interaction between morphology and syntax exhibited by the German writing system		2011	fuhrhop_exhibited-writing2011
Færch-1984-ja_und__og	Færch, Claus and Kasper, Gabriele		Ja und? - og hva' så ? - a contrastive discourse analysis of gambits in German and Danish		1984	faerch-kasper_hva-gambits1984
Féry-1991-german_schwa_in_prosodic	Féry, Caroline		German schwa in prosodic morphology		1991	fery_schwa-prosodic1991
Féry-2003-final_devoicing_and_the	Féry, Caroline		Final Devoicing and the stratification of the lexicon in German		2003	fery_devoicing-stratification2003
Féry-2005-the_focus_and_prosodic	Féry, Caroline and Hartmann, Katharina		The focus and prosodic structure of German Right Node Raising and Gapping		2005	fery-hartmann_node-gapping2005
Gagarina-2012-discourse_cohesion_in_the	Gagarina, Natalia		Discourse cohesion in the elicited narratives of early Russian-German sequential bilinguals		2012	gagarina_elicited-sequential2012
Gerdes-2001-word_order_in_german	Gerdes, Kim and Kahane, Sylvain		Word Order in German: A Formal Dependency Grammar Using a Topological Hierarchy		2001	gerdes-kahane_topological-hierarchy2001
Geyken-2015-a_living_text_archive	Geyken, Alexander and Gloning, Thomas		A Living Text Archive of 15th–19th Century German: Corpus Strategies, Technology, Organization		2015	geyken-gloning_living-archive2015
Giegerich-1985-metrical_phonology_and_phonological	Giegerich, Heinz J		Metrical Phonology and Phonological Structure. German and English		1985	giegerich_metrical-phonological1985
Giegerich-1989-syllable_structure_and_lexical	Giegerich, Heinz J.		Syllable structure and lexical derivation in German		1989	giegerich_syllable-derivation1989
Giinthner-2000-from_concessive_connector_to	Giinthner, Susanne		From concessive connector to discourse marker: The use of obwohl in everyday German interaction		2000	giinthner_connector-obwohl2000
Gilbert-1970-6_the_phonology_morphology	Gilbert, Glenn G.		6. The Phonology, Morphology, and Lexicon of a German Text from Fredericksburg, Texas		1970	gilbert_fredericksburg-texas1970
Giusti-1990-the_syntax_of_floating	Giusti, Giuliana and Abraham, Wim Kosmeijer Werner and Reuland, Eric	Giusti, Giuliana // Giusti, Giuliana and Abraham, Wim Kosmeijer Werner and Reuland, Eric	The syntax of floating ‘alles’ in German	The syntax of floating alles in German // The syntax of floating ‘alles’ in German	1990	abraham-giusti-reuland_floating-alles1990 giusti_floating-alles1990
Giusti-1991-zuinfinitivals_and_sentential_structure	Giusti, Giuliana		Zu-infinitivals and sentential structure in German		1991	giusti_infinitivals-sentential1991
Goebel-2000-from_text_to_example	Goebel, Ulrich		From Text to Example. The Early New High German Project		2000	goebel_example-high2000
Golato-2002-grammar_and_interaction_reported	Golato, Andrea		Grammar and Interaction: Reported Discourse and Subjunctive in German		2002	golato_reported-subjunctive2002
Golston-1996-zero_morphology_and_constraint	Golston, Chris and Wiese, Richard		Zero morphology and constraint interaction. Subtraction and epenthesis in German Dialects		1996	golston-wiese_subtraction-epenthesis1996
Golston-1998-the_structure_of_the	Golston, Chris and Wiese, Richard		The structure of the German root		1998	golston-wiese_german-root1998
Goss-2000-the_evolution_of_a	Goss, Emily L. and Salmons, Joseph C.		The evolution of a bilingual discourse marking system: Modal particles and English markers in German-American dialects		2000	goss-salmons_modal-particles2000
Grabe-1998-comparative_intonational_phonology_english	Grabe, Esther		Comparative intonational phonology: English and German		1998	grabe_intonational-german1998
Grestenberger-2015-number_marking_in_german	Grestenberger, Laura		Number marking in German measure phrases and the structure of pseudo-partitives		2015	grestenberger_measure-partitives2015
Grewendorf-1993-german_a_grammatical_sketch	Grewendorf, Günther		German: A Grammatical Sketch		1993	grewendorf_german-sketch1993
Grewendorf-1995-german_a_grammatical_sketch	Grewendorf, Günther		German: A Grammatical Sketch		1995	grewendorf_german-sketch1995
Grice-2005-german_intonation_in_autosegmentalmetrical	Grice, Martine and Baumann, Stefan and Benzmüller, Ralf	Grice, Martine and Baumann, Stefan and Benzmüller, Ralf // Grice, Martine and Baumann, Stefan and Benzmülller, Ralf	German intonation in autosegmental-metrical phonology	German intonation in Autosegmental-Metrical phonology // German intonation in autosegmental-metrical phonology	2005	baumann-benzmuller-grice_autosegmental-metrical2005 baumann-benzmulller-grice_autosegmental-metrical2005
Grijzenhout-1998-the_role_of_coronal	Grijzenhout, Janet		The role of coronal specification in German and Dutch phonology and morphology		1998	grijzenhout_coronal-specification1998
Grimm-1822-deutsche_grammatik_german_grammar	Grimm, Jacob		Deutsche Grammatik [German grammar]		1822	grimm_deutsche-grammatik1822
Grimm-1999-deutsches_worterbuch_von_jacob	Grimm, Jacob and Grimm, Wilhelm		Deutsches Wörterbuch von Jacob Grimm und Wilhelm Grimm		1999	grimm-grimm_jacob-grimm1999
Grimm-2006-intonational_patterns_and_word	Grimm, Angela		Intonational patterns and word structure in early child german		2006	grimm_intonational-child2006
Grosz-2005-dn_in_viennese_german	Grosz, Patrick		“Dn” in Viennese German. The syntax of a clitic version of the discourse particle “denn”		2005	grosz_dn-viennese2005
Grote-2000-a_german_prepositional_phrase	Grote, Brigitte		A German prepositional phrase grammar		2000	grote_prepositional-phrase2000
Grove-2016-article_selection_and_anaphora	Grove, Julian and Hanink, Emily		Article selection and anaphora in the German relative clause		2016	grove-hanink_article-anaphora2016
Gut-2001-crosslinguistic_structures_in_the	Gut, Ulrike		Cross-Linguistic Structures in the Acquisition of Intonational Phonology by German-English Bilingual Children		2001	gut_structures-intonational2001
Gut-2008-phonology_of_advanced_learners	Gut, Ulrike		Phonology of advanced learners of German		2008	gut_advanced-learners2008
Gut-2009-nonnative_speech_a_corpusbased	Gut, Ulrike		Non-Native Speech: A Corpus-Based Analysis of Phonological and Phonetic Properties of L2 English and German		2009	gut_phonetic-properties2009
Gut-2010-88_nonnative_speech_a	Gut, Ulrike		88. Non-native speech. A corpus-based analysis of phonological and phonetic properties of L2 English and German.		2010	gut_phonetic-properties2010
Gutzmann-2012-expressive_intensifiers_in_german	Gutzmann, Daniel and Piñíon, Christopher		Expressive intensifiers in German: syntax-semantics mismatches		2012	gutzmann-pinion_intensifiers-mismatches2012
Gärtner-2000-what_do_reduced_pronominals	Gärtner, Hans-Martin and Steinbach, Markus and Gärtner, Hans-Martin		What do reduced pronominals reveal about the syntax of Dutch and German?		2000	gartner-gartner-steinbach_reduced-pronominals2000
Günthner-2000-from_concessive_connector_to	Günthner, Susanne and Brinton, Heidi C. and Gotti, Maurizio A.		From concessive connector to discourse marker: The use of obwohl in everyday German interaction		2000	brinton-gotti-gunthner_connector-obwohl2000
Günthner-2003-lexicalgrammatical_variation_and_development	Günthner, Susanne		Lexical-grammatical variation and development: The use of conjunctions as discourse markers in everyday spoken German		2003	gunthner_conjunctions-everyday2003
Habermann-2007-aspects_of_a_diachronic	Habermann, Mechthild		Aspects of a diachronic valency syntax of German		2007	habermann_diachronic-valency2007
Hachem-2015-multifunctionality_the_internal_and	Hachem, Mirjam		Multifunctionality. The Internal and External Syntax of d- and w-Items in German and Dutch		2015	hachem_multifunctionality-items2015
Haider-1993-deutsche_syntax__generativ	Haider, Hubert		Deutsche Syntax – generativ: Vorstudien zur Theorie einer projektiven Grammatik [German syntax – generative: Preliminary studies on the theory of a projective grammar]		1993	haider_generativ-projektiven1993
Haider-1997-projective_economy_on_the	Haider, Hubert		Projective Economy: On the Minimal Functional Structure of the German Clause		1997	haider_projective-minimal1997
Haider-2010-the_syntax_of_german	Haider, Hubert		The syntax of German		2010	haider_syntax-german2010
Hale-1966-review_of_syntax_des	Hale, Austin		Review of: Syntax des deutschen Adjektivs, by Wolfgang Motsch		1966	hale_adjektivs-motsch1966
Hall-1989-lexical_phonology_and_the	Hall, Tracy Alan		Lexical phonology and the distribution of German [ç] and [x]		1989	hall_distribution-german1989
Hall-1992-syllable_structure_and_syllablerelated	Hall, Tracy Alan		Syllable Structure and Syllable-Related Processes in German		1992	hall_syllable-related1992
Hall-1993-the_phonology_of_german	Hall, Tracy Alan		The phonology of German /ʀ/		1993	hall_phonology-german1993
Hall-1998-a_note_on_secondary	Hall, T. A.		A Note on Secondary Stress in German Prosodic Morphology		1998	hall_secondary-stress1998
Hall-1999-phonotactics_and_the_prosodic	Hall, Tracy Alan and Hall, Tracy Alan and Kleinhenz, Ursula	Hall, T. Alan // Hall, Tracy Alan and Hall, Tracy Alan and Kleinhenz, Ursula	Phonotactics and the prosodic structure of German function words	Phonotactics and the Prosodic Structure of German Function Words // Phonotactics and the prosodic structure of German function words	1999	hall-hall-kleinhenz_phonotactics-function1999 hall_phonotactics-function1999
Hall-1999-the_phonological_word_a	Hall, T. A.		The phonological word: a review		1999	hall_phonological-review1999
Hall-2002-loanword_nativization_in_modern	Hall, T. A. and Hamann, S.		Loanword nativization in Modern Standard German as evidence for the phonological word		2002	hall-hamann_loanword-nativization2002
Hall-2003-modern_german_pronunciation_an	Hall, Christopher		Modern German pronunciation: An introduction for speakers of English		2003	hall_pronunciation-speakers2003
Hall-2014-the_phonology_of_westphalian	Hall, Tracy Alan		The phonology of Westphalian German glides		2014	hall_westphalian-glides2014
Hall-2022-velar_fronting_in_german	Hall, Tracy Alan		Velar fronting in German dialects: A study in synchronic and diachronic phonology		2022	hall_velar-fronting2022
Hamm-2009-donhauser_karin__annette	Hamm, Joachim		Donhauser, Karin \& Annette Fischer \& Lars Mecklenburg. 2006. Moutons Interaktive Einführung in die Historische Linguistik des Deutschen. The Mouton Interactive Introduction to Historical Linguistics of German. Berlin, New York: Mouton de Gruyter		2009	hamm_donhauser-moutons2009
Hammond-1981-a_german_reference_grammar	Hammond, Robin		A German Reference Grammar		1981	hammond_german-reference1981
Hanink-2018-postsyntactic_inflection_of_the	Hanink, Emily		Postsyntactic inflection of the degree phrase in German		2018	hanink_postsyntactic-degree2018
Happ-2014-deutsche_gebardensprache_ein_lehr	Happ, Daniela and Vorköper, Marc-Oliver		Deutsche Gebärdensprache: ein Lehr- und Arbeitsbuch [German Sign Language: a text- and workbook]		2014	happ-vorkoper_lehr-arbeitsbuch2014
Harbert-1977-clause_union_and_german	Harbert, Wayne		Clause union and German accusative plus infinitive constructions		1977	harbert_accusative-plus1977
Harren-2007-11_arbeitstagung_zur_gesprachsforschung	Harren, Inga		11. Arbeitstagung zur Gesprächsforschung am Institut für Deutsche Sprache in Mannheim, 6.-8. April 2005 / 11th workshop on conversation and discourse analysis at the German Language Institute in Mannheim, 6–8 April 2005		2007	harren_gesprachsforschung-mannheim2007
Hartmann-2006-comparative_studies_in_germanic	Hartmann, Jutta M. and Molnárfi, László		Comparative Studies in Germanic Syntax. From Afrikaans to Zurich German		2006	hartmann-molnarfi_germanic-zurich2006
Hartmann-2018-derivational_morphology_in_flux	Stefan Hartmann		Derivational morphology in flux: a case study of word-formation change in German		2018	hartmann_derivational-flux2018
Haselbach-2011-deconstructing_the_meaning_of	Haselbach, Boris		Deconstructing the Meaning of the German Temporal Verb Particle "nach" at the Syntax-Semantics Interface		2011	haselbach_deconstructing-particle2011
Hasse-2019-the_interaction_of_phonological	Hasse, Anja		The interaction of phonological and morphological variation in Zurich German		2019	hasse_morphological-zurich2019
Hawkins-1995-argumentpredicate_structure_in_grammar	Hawkins, John A.		Argument-predicate structure in grammar and performance: A comparison of English and German		1995	hawkins_predicate-performance1995
Heid-2008-providing_corpus_data_for	Heid, Ulrich and Fritzinger, Fabienne and Hauptmann, Susanne and Weidenkaff, Julia and Weller, Marion		Providing corpus data for a dictionary for German juridical phraseology		2008	fritzinger-hauptmann-heid-weidenkaff-weller_providing-juridical2008
Heide-2010-the_influence_of_morphological	Heide, Judith and Lorenz, Antje and Meinunger, André and Burchert, Frank		The influence of morphological structure on the processing of German prefixed verbs		2010	burchert-heide-lorenz-meinunger_influence-prefixed2010
Heinz-1994-argument_structure_and_case	Heinz, Wolfgang and Matiasek, Johannes		Argument Structure and Case Assignment in German		1994	heinz-matiasek_argument-assignment1994
Hempl-1898-german_orthography_and_phonology	Hempl, George		German Orthography and Phonology		1898	hempl_german-orthography1898
Hendriks-2005-structuring_space_in_discourse	Hendriks, Henriëtte		Structuring space in discourse: A comparison of Chinese, English, French and German LI and English, French and German L2 acquisition		2005	hendriks_structuring-li2005
Hickey-2000-on_the_phonology_of	Hickey, Raymond		On the phonology of gender in Modern German		2000	hickey_gender-modern2000
Hinrichs-1989-subcategorization_and_vp_structure	Hinrichs, Erhard W. and Nakazawa, Tsuneko		Subcategorization and VP Structure in German		1989	hinrichs-nakazawa_subcategorization-vp1989
Hinterhölzl-2018-implications_of_displaced_affixes	Hinterhölzl, Roland		Implications of displaced affixes for the analysis of non-finite morphology and the headedness of the VP in German		2018	hinterholzl_displaced-headedness2018
Hoeing-1997-the_phrase_structure_of	Hoeing, Robert G.		The phrase structure of partitives in High German		1997	hoeing_partitives-high1997
Hohaus-2021-comparisons_of_equality_with	Hohaus, Vera and Zimmermann, Malte		Comparisons of equality with German so…wie, and the relationship between degrees and properties		2021	hohaus-zimmermann_equality-degrees2021
Hohenstein-2005-interactional_expectations_and_lingusitic	Hohenstein, Christiane		Interactional expectations and lingusitic knowledge in academic expert discourse (Japanese / German)		2005	hohenstein_lingusitic-expert2005
Hoole-2002-articulatory_analysis_of_the	Hoole, Philip and Mooshammer, Christine		Articulatory analysis of the German vowel system		2002	hoole-mooshammer_articulatory-vowel2002
Hopp-2011-internal_and_external_factors	Hopp, Holger		Internal and external factors in the child L2 development of the German determiner phrase		2011	hopp_external-determiner2011
House-1996-contrastive_discourse_analysis_and	House, Juliane		Contrastive discourse analysis and misunderstanding: The case of German and English		1996	house_contrastive-misunderstanding1996
House-2011-linking_constructions_in_english	House, Juliane		Linking constructions in English and German translated and original texts		2011	house_linking-original2011
Hüning-2010-adjective__noun_constructions	Hüning, Matthias		Adjective + Noun constructions between syntax and word formation in Dutch and German		2010	huning_adjective-formation2010
Ickelsamer-1535-teutsche_grammatica	Ickelsamer, Valentin		Teutsche Grammatica		1535	ickelsamer_teutsche-grammatica1535
Iverson-1992-the_place_of_structure	Iverson, Gregory K. and Salmons, Joseph C.		The place of structure preservation in German diminutive formation		1992	iverson-salmons_preservation-diminutive1992
Jacobs-1986-the_syntax_of_focus	Jacobs, Joachim		The Syntax of Focus and Adverbials in German		1986	jacobs_focus-adverbials1986
Jacobs-2018-on_main_clause_phenomena	Jacobs, Joachim and Steinbach, Markus and Grewendorf, Arnim and von Stechow, Güntherad		On main clause phenomena in German		2018	grewendorf-jacobs-stechow-steinbach_main-phenomena2018
Jambressisch-1742-lexicon_latinum_lexicon_latinum	Andrea Jambressisch		Lexicon Latinum: Lexicon Latinum interpretatione Illyrica, Germanica, et Hungarica locuples		1742	jambressisch_illyrica-locuples1742 jambressisch_illyrica-locuples1742 jambressisch_illyrica-locuples1742
Jarnatovskaja-1984-zu_stilistischen_moglichkeiten_der	Jarnatovskaja, Valebia E.		Zu stilistischen Möglichkeiten der Morphologie in der deutschen Gegenwartssprache		1984	jarnatovskaja_stilistischen-moglichkeiten1984
Jessen-1995-acoustic_correlates_of_word	Jessen, Michael and Marasek, Krzysztof and Schneider, Katrin and Clahßen, Kathrin		Acoustic Correlates of Word Stress and the Tense/Lax Opposition in the Vowel System of German		1995	clahssen-jessen-marasek-schneider_lax-opposition1995
Jessen-1998-phonetics_and_phonology_of	Jessen, Michael		Phonetics and Phonology of Tense and Lax Obstruents in German		1998	jessen_lax-obstruents1998
Jessen-1999-phonetics_and_phonology_of	Jessen, Michael		Phonetics and Phonology of Tense and Lax Obstruents in German		1999	jessen_lax-obstruents1999
Jobin-2011-semantically_driven_change_in	Jobin, Bettina		Semantically driven change in German(ic) gender morphology		2011	jobin_semantically-ic2011
Johnson-1986-a_gpsg_account_of	Johnson, Mark		A GPSG account of VP structure in German		1986	johnson_gpsg-vp1986
Jones-1976-a_lexicon_of_french	Jones, William Jervis		A Lexicon of French Borrowings in the German Vocabulary (1575-1648)		1976	jones_lexicon-borrowings1976
Jones-2000-german_lexicography_in_the	Jones, William Jervis		German Lexicography in the European Context. A descriptive bibliography of printed dictionaries and word lists containing German language (1600-1700)		2000	jones_printed-containing2000
Jones-2005-a_frequency_dictionary_of	Jones, Randall L. and Tschirner, Erwin P.		A frequency dictionary of German		2005	jones-tschirner_frequency-german2005
Jones-2006-a_frequency_dictionary_of	Jones, Randall L. and Tschirner, Erwin		A Frequency Dictionary of German		2006	jones-tschirner_frequency-german2006
Joswig-2005-review_of_the_phonology	Joswig, Andreas		Review of: The phonology of German		2005	joswig_review-german2005
