ID	Creators	Creator_Variants	Title	Title_Variants	Year	Sources
Junker-1965-persischdeutsches_worterbuch	Junker, Heinrich F. J. and Bozorg, Alavi		Persisch-deutsches Wörterbuch		1965	bozorg-junker_persisch-deutsches1965 bozorg-junker_persisch-deutsches1965 bozorg-junker_persisch-deutsches1965
Junker-1966-persischdeutsches_worterbuch	Junker, Heinrich F. J. and Bozorg, Alavi		Persisch-deutsches Wörterbuch		1966	bozorg-junker_persisch-deutsches1966 bozorg-junker_persisch-deutsches1966 bozorg-junker_persisch-deutsches1966
Junker-2002-persischdeutsch_worterbuch	Junker, Heinrich F. J. and Alavi, Bozorg		Persisch-Deutsch Wörterbuch		2002	alavi-junker_persisch-worterbuch2002
Jurish-2008-finding_canonical_forms_for	Jurish, Bryan		Finding canonical forms for historical German text		2008	jurish_finding-canonical2008
Kabak-2006-the_phonology_and_morphology	Kabak, Barış and Schiering, René		The phonology and morphology of function word contractions in German		2006	kabak-schiering_function-contractions2006
Kabatnik-2022-relationship_management_by_means	Kabatnik, Susanne and Nikendei, Christoph and Ehrenthal, Johannes C. and Spranz-Fogasy, Thomas		Relationship management by means of solution-oriented questions in German psychodiagnostic interviews		2022	ehrenthal-kabatnik-nikendei-spranz-fogasy_solution-psychodiagnostic2022
Kameyama-2004-modal_expressions_in_japanese	Kameyama, Shinichi		Modal expressions in Japanese and German planning discourse		2004	kameyama_modal-planning2004
Karagjosova-2004-the_meaning_and_function	Karagjosova, Elena		The meaning and function of German discourse particles		2004	karagjosova_function-particles2004
Kasper-2015-3_linking_syntax_and	Kasper, Simon		3. Linking syntax and semantics of adnominal possession in the history of German		2015	kasper_linking-adnominal2015
Kastovsky-1994-typological_differences_between_english	Kastovsky, Dieter		Typological differences between English and German morphology and their causes		1994	kastovsky_differences-causes1994
Kathol-1995-linearizationbased_german_syntax	Kathol, Andreas		Linearization-Based German Syntax		1995	kathol_linearization-based1995
Kathol-1999-linearization_vs_phrase_structure	Kathol, Andreas		Linearization vs. phrase structure in German coordination constructions		1999	kathol_linearization-coordination1999
Kathol-2001-positional_effects_in_a	Kathol, Andreas		Positional Effects in a Monostratal Grammar of German		2001	kathol_positional-monostratal2001
Kaufmann-2005-the_auin_translated_from	Kaufmann, Hans L.		The Auin [translated from German]		2005	kaufmann_auin-translated2005
Kauschke-2007-characteristics_of_maternal_input	Kauschke, Christina and Klann-Delius, Gisela		Characteristics of maternal input in relation to vocabulary development in children learning German		2007	kauschke-klann-delius_maternal-input2007
Kempen-2003-6_dutch_and_german	Kempen, Gerard and Harbusch, Karin		6. Dutch and German verb constructions in Performance Grammar		2003	harbusch-kempen_dutch-performance2003
Kienpointner-2005-semantic_roles_within_a	Kienpointner, Manfred		Semantic Roles within a Contrastive Grammar of Latin and German		2005	kienpointner_roles-within2005
Kirkness-2006-die_grimmschen_handexemplare_des	Kirkness, Alan		Die Grimmschen Handexemplare des Deutschen Wörterbuchs A – F / The Grimm author's copies of the German Dictionary A – F		2006	kirkness_grimmschen-handexemplare2006
Kirsten-1991-adolf_lamprechts_german_grammar	Kirsten, Hans		Adolf Lamprecht's (German) Grammar of English		1991	kirsten_adolf-lamprechts1991
Klaper-2013-building_a_germansimple_german	Klaper, David and Ebling, Sarah and Volk, Martin		Building a German/simple German parallel corpus for automatic text simplification		2013	ebling-klaper-volk_automatic-simplification2013
Klein-2002-the_argumenttime_structure_of	Klein, Wolfgang		The argument-time structure of recipient constructions in German		2002	klein_argument-recipient2002
Knop-2017-chapter_7_the_family	Knop, Sabine and Mollica, Fabio		Chapter 7. The family of German dative constructions		2017	knop-mollica_family-dative2017
Kohler-1991-terminal_intonation_patterns_in	Kohler, Klaus J.		Terminal Intonation Patterns in Single-Accent Utterances of German: Phonetics, Phonology, and Semantics		1991	kohler_terminal-single1991
Kohler-1995-einfuhrung_in_die_phonetik	Kohler, Klaus J.		Einführung in die Phonetik des Deutschen. 2., neubearbeitete Auflage		1995	kohler_neubearbeitete-auflage1995
Konerding-2004-wolfgang_j_koschnick_management	Konerding, Klaus-Peter		Wolfgang J. Koschnick: Management and Marketing/Management und Marketing. Encyclopedic Dictionary English–German/Enzyklopädisches Wörterbuch Englisch–Deutsch. Berlin, New York: Walter de Gruyter. 1998. 859 S.		2004	konerding_koschnick-enzyklopadisches2004
Konerding-2005-handbuch_der_deutschen_konnektoren	Konerding, Klaus-Peter		Handbuch der deutschen Konnektoren [Manual of the German connectors]		2005	konerding_konnektoren-connectors2005
Konrad-2013-the_lexical_structure_of	Konrad, Reiner		The lexical structure of German Sign Language (DGS) in the light of empirical LSP lexicography		2013	konrad_dgs-lsp2013
Kosta-2006-on_free_word_order	Kosta, Peter		On Free Word Order Phenomena in Czech as Compared to German: Is Clause Internal Scrambling Α-Movement, A-Bar-Movement or Is It Base Generated?		2006	kosta_bar-generated2006
Kraehenmann-2003-swiss_german_vowel_length	Kraehenmann, Astrid		Swiss German vowel length through time		2003	kraehenmann_swiss-length2003
Kraiss-2012-determiner_phrase_and_definiteness	Kraiss, Andrew M.		Determiner Phrase and Definiteness in Old High German		2012	kraiss_determiner-definiteness2012
Kramer-2011-klappenbachsteinitz_worterbuch_der_deutschen	Kramer, Undine		Klappenbach/Steinitz: Wörterbuch der deutschen Gegenwartssprache (WDG)		2011	kramer_klappenbach-wdg2011
Krause-1999-two_notes_on_prenominal	Krause, Cornelia		Two notes on prenominal possessors in German		1999	krause_prenominal-possessors1999
Krenn-2008-description_of_evaluation_resource	Krenn, Brigitte		Description of Evaluation Resource – German PP-verb data		2008	krenn_evaluation-resource2008
Kresić-2017-chapter_8_a_format	Kresić, Marijana and Angster, Mia Batinić and Diewald, Gabriele		Chapter 8. A format for the description of German modal particles and their functional equivalents in Croatian and English		2017	angster-diewald-kresic_format-equivalents2017
Kunz-2013-towards_a_comparison_of	Kunz, Kerstin and Steiner, Erich		Towards a comparison of cohesive reference in English and German: System and text		2013	kunz-steiner_comparison-cohesive2013
Kutscher-2007-nonverbale_pradikation_in_der	Kutscher, Silvia and Geist, Ljudmila and Rothstein, Björn		Non-verbale Prädikation in der Deutschen Gebärdensprache (DGS): Probleme der Abgrenzung von Attribution und Prädikation in einer kopulalosen Sprache [Non-verbal predication in German Sign Language: problems in differentiating between attribution and predication in a language without copulas]		2007	geist-kutscher-rothstein_pradikation-kopulalosen2007
Kuzla-2010-compensation_for_assimilatory_devoicing	Kuzla, Claudia and Ernestus, Mirjam and Mitterer, Holger		Compensation for assimilatory devoicing and prosodic structure in German fricative perception		2010	ernestus-kuzla-mitterer_compensation-assimilatory2010
Kučera-1968-a_comparative_quantitative_phonology	Kučera, Henry and Monroe, George K.		A Comparative Quantitative Phonology of Russian, Czech, and German		1968	kucera-monroe_quantitative-czech1968
König-1988-clause_integration_in_german	König, Ekkehard and Auwera, Johan		Clause integration in German and Dutch conditionals, concessive conditionals, and concessives		1988	auwera-konig_concessive-concessives1988
König-1990-adverbien_und_partikeln_ein	König, Ekkehard and Stark, Detlef and Requardt, Susanne		Adverbien und Partikeln: Ein deutschenglisches Wörterbuch [Adverbs and Particles: A German–English Dictionary]		1990	konig-requardt-stark_adverbien-deutschenglisches1990
Kügler-2009-sentence_length_position_and	Kügler, Frank and Genzel, Susanne		Sentence length, position, and information structure on segmental duration in German		2009	genzel-kugler_length-duration2009
Lambek-2000-type_grammar_meets_german	Lambek, J.		Type Grammar Meets German Word Order		2000	lambek_type-meets2000
Langer-1998-werner_abraham__elly	Langer, Nils		Werner Abraham / Elly van Gelderen (Hgg.): German: Syntactic Problems - Problematic Syntax		1998	langer_elly-gelderen1998
Lapshinova-Koltunski-2010-german_clauseembedding_predicates	Lapshinova-Koltunski, Ekaterina		German Clause-Embedding Predicates		2010	lapshinova-koltunski_embedding-predicates2010
Lederer-1969-reference_grammar_of_the	Lederer, Herbert		Reference grammar of the German language [Grammatik der deutschen Sprache <eng.>]	Reference Grammar of the German Language // Reference grammar of the German language [Grammatik der deutschen Sprache <eng.>]	1969	lederer_grammatik-deutschen1969 lederer_reference-german1969
Lee-Schoenfeld-2007-beyond_coherence_the_syntax	Lee-Schoenfeld, Vera		Beyond Coherence. The syntax of opacity in German		2007	lee-schoenfeld_coherence-opacity2007
Lee-Schoenfeld-2016-the_syntax_of_external	Lee-Schoenfeld, Vera and Diewald, Gabriele		The syntax of external and internal possessor variation in German inalienable possession		2016	diewald-lee-schoenfeld_possessor-inalienable2016
Legère-1973-contrastive_sketch_of_postnominal	Legère, Karsten		[Contrastive sketch of post-nominal constructions in Kiswahili and parts of speech in German]		1973	legere_post-parts1973
Lehn-1957-rosental_low_german_synchronic	Lehn, Walter Isaak		Rosental Low German synchronic and diachronic phonology		1957	lehn_rosental-low1957
Lehn-1957-rosenthal_low_german_synchronic	Lehn, Walter Isaak		Rosenthal Low German: Synchronic and diachronic phonology		1957	lehn_rosenthal-low1957
Lehr-2004-zeitgeschichtliches_worterbuch_der_deutschen	Lehr, Andrea		Zeitgeschichtliches Wörterbuch der deutschen Gegenwartssprache [Contemporary-historical lexicon of present-day German]		2004	lehr_zeitgeschichtliches-gegenwartssprache2004
Lettner-2013-uwe_quasthoff_sabine_fiedler	Lettner, Khrystyna and Schierholz, Stefan J.		Uwe Quasthoff, Sabine Fiedler, Erla Hallsteinsdóttir (eds., 2011): Frequency Dictionary German. Häufigkeitswörterbuch Deutsch		2013	lettner-schierholz_quasthoff-hallsteinsdottir2013
Lindauer-2002-how_syllable_structure_affects	Lindauer, Thomas		How Syllable Structure affects Spelling: A Case Study in Swiss German Syllabification		2002	lindauer_affects-swiss2002
Lindtner-2008-aufgabe__desiderate_	Lindtner, Heide and Barth-Weingarten, Dagmar		Aufgabe – Desiderate – Perspektiven. Bericht über die 13. Arbeitstagung zur Gesprächsforschung vom 28. bis 30. März 2007 am Institut für Deutsche Sprache in Mannheim		2008	barth-weingarten-lindtner_desiderate-gesprachsforschung2008
List-2020-towards_a_refined_wordlist	List, Johann-Mattis		Towards a refined wordlist of German in the Intercontinental Dictionary Series		2020	list_refined-intercontinental2020
List-2021-using_edictor_20_to	List, Johann-Mattis		Using EDICTOR 2.0 to Annotate Language-Internal Cognates in a German Wordlist		2021	list_edictor-annotate2021
Lobin-1989-a_dependency_syntax_of	Lobin, Henning		A dependency syntax of German		1989	lobin_dependency-german1989
Loch-2005-kleines_worterbuch_tetum_	Loch, Alexander and Tschanz, Maria		Kleines Wörterbuch Tetum - Deutsch / Deutsch - Tetum Disionário ki'ik Tetun - Alemaun / Alemaun - Tetun		2005	loch-tschanz_disionario-kiik2005 loch-tschanz_disionario-kiik2005
Lockwood-1968-historical_german_syntax	Lockwood, William B.		Historical German syntax		1968	lockwood_historical-german1968
Lohnstein-2004-inflectional_morphology_and_sentence	Lohnstein, Horst and Bredel, Ursula		Inflectional morphology and sentence mood in German		2004	bredel-lohnstein_inflectional-mood2004
Louden-1992-language_contact_and_the	Louden, Mark L.		Language Contact and the Relationship of Form and Meaning in English and German		1992	louden_relationship-form1992
Lutz-2004-et_parasitic_gaps_and	Lutz, Uli		ET, parasitic gaps, and German clause structure		2004	lutz_parasitic-gaps2004
Lutz-2010-word_accent_position_and	Lutz, Angelika		Word Accent Position and Language Contact in English and German		2010	lutz_accent-position2010
Lutzeier-1991-major_pillars_of_german	Lutzeier, Peter Rolf		Major pillars of German syntax. An introduction to CRMS-theory		1991	lutzeier_pillars-crms1991
Lötscher-2009-katrin_axel_studies_on	Lötscher, Andreas		Katrin Axel, Studies on Old High German Syntax		2009	lotscher_katrin-axel2009
Lühr-2009-translating_information_structure_a	Lühr, Rosemarie		Translating information structure: A study of Notker’s translation of Boethius’s Latin De Consolatione Philosophiae into Old High German		2009	luhr_boethiuss-consolatione2009
Mannheimer-1853-the_study_of_german	Mannheimer, H.		The study of German simplified in a new systematic and practical grammar according to the systems of Ollendorf and Dr. Ahn		1853	mannheimer_ollendorf-ahn1853
Marusch-2012-tense_morphology_in_german	Marusch, Tina and von der Malsburg, Titus and Bastiaanse, Roelien and Burchert, Frank		Tense morphology in German agrammatism		2012	bastiaanse-burchert-malsburg-marusch_tense-agrammatism2012
Marzouk-2021-german_light_verb_construction	Marzouk, Shaimaa		German light verb construction in the course of the development of Machine Translation		2021	marzouk_light-machine2021
Max-2008-dimensions_of_discourse_presuppositions	Max, Ingolf		Dimensions of Discourse: Presuppositions of (German) Connectors		2008	max_presuppositions-connectors2008
Maylor-2002-lexical_template_morphology_change	Maylor, B. Roger		Lexical Template Morphology. Change of state and the verbal prefixes in German		2002	maylor_template-prefixes2002
McFadden-2006-german_inherent_datives_and	McFadden, Thomas		German inherent datives and argument structure		2006	mcfadden_inherent-datives2006
McIntyre-2001-german_double_particles_as	McIntyre, Andrew		German double particles as preverbs: Morphology and conceptual semantics		2001	mcintyre_double-preverbs2001
McIntyre-2002-verbsecond_and_backformations_and	McIntyre, Andrew		Verb-second and backformations and scalar prefix verbs in German: The interaction between morphology, syntax and phonology		2002	mcintyre_backformations-scalar2002
McLelland-2014-language_description_prescription_and	McLelland, Nicola		Language description, prescription and usage in seventeenth-century German		2014	mclelland_prescription-seventeenth2014
Meinhold-1982-phonologie_der_deutschen_gegenwartssprache	Meinhold, Gottfried and Stock, Eberhard		Phonologie der deutschen Gegenwartssprache		1982	meinhold-stock_phonologie-gegenwartssprache1982
Meurers-1999-lexical_generalizations_in_the	Meurers, Walt Detmar		Lexical Generalizations in the Syntax of German Non-Finite Constructions		1999	meurers_generalizations-finite1999
Meurers-2000-lexical_generalizations_in_the	Meurers, Walt Detmar		Lexical Generalizations in the Syntax of German Non-Finite Constructions		2000	meurers_generalizations-finite2000
Meyer-1993-compound_comprehension_in_isolation	Meyer, Ralf		Compound comprehension in isolation and in context: The contribution of conceptual and discourse knowledge to the comprehension of German novel noun-noun compounds		1993	meyer_isolation-novel1993
Miao-2005-loanword_adaption_in_mandarin	Miao, Ruiqin		Loanword adaption in Mandarin Chinese: perceptual, phonological and sociolinguistic factors		2005	miao_loanword-adaption2005 miao_loanword-adaption2005 miao_loanword-adaption2005
Micelli-2012-field_topology_and_information	Micelli, Vanessa		Field Topology and Information Structure: A Case Study for German Constituent Order		2012	micelli_topology-constituent2012
Moltmann-1990-syllabification_and_lexical_phonology	Moltmann, Friederike		Syllabification and lexical phonology in German		1990	moltmann_syllabification-german1990
Muthmann-1991-rucklaufiges_deutsches_worterbuch_handbuch	Muthmann, Gustav		Rückläufiges deutsches Wörterbuch: Handbuch der Wortausgänge im Deutschen, mit Beachtung der Wort- und Lautstruktur		1991	muthmann_wortausgange-beachtung1991
Mücke-2008-the_vowel_triggers_the	Mücke, Doris and Grice, Martine and Hermes, Anne		The vowel triggers the tone: Evidence from German		2008	grice-hermes-mucke_vowel-triggers2008
Müller-1996-early_subordination_the_acquisition	Müller, Natascha and Penner, Zvi		Early subordination: the acquisition of free morphology in French, German, and Swiss German		1996	muller-penner_subordination-swiss1996
Müller-1996-yet_another_paper_about	Müller, Stefan		Yet another Paper about Partial Verb Phrase Fronting in German		1996	muller_yet-fronting1996
Müller-1997-yet_another_paper_about	Müller, Stefan		Yet another Paper about Partial Verb Phrase Fronting in German		1997	muller_yet-fronting1997
Müller-1999-deutsche_syntax_deklarativ_headdriven	Müller, Stefan		Deutsche Syntax deklarativ: Head-Driven Phrase Structure Grammar für das Deutsche [German syntax declarative: Head-Driven Phrase Structure Grammar for German]		1999	muller_deklarativ-declarative1999
Müller-1999-parsing_of_an_hpsg	Müller, Stefan		Parsing of an HPSG Grammar for German: Word Order Domains and Discontinuous Constituents		1999	muller_discontinuous-constituents1999
Müller-2002-syntax_or_morphology_german	Müller, Stefan		Syntax or morphology: German particle verbs revisited		2002	muller_particle-revisited2002
Müller-2003-solving_the_bracketing_paradox	Müller, Stefan		Solving the Bracketing Paradox: An Analysis of the Morphology of German Particle Verbs		2003	muller_solving-bracketing2003
Müller-2004-das_worterbuch_der_deutschen	Müller, Wolfgang		Das Wörterbuch der deutschen Präpositionen [The lexicon of German prepositions]		2004	muller_prapositionen-prepositions2004
Müller-2015-german_a_grammatical_sketch	Müller, Stefan		German: A Grammatical Sketch		2015	muller_german-sketch2015
Müller-2016-german_clause_structure_an	Müller, Stefan		German Clause Structure: An Analysis with Special Consideration of So-Called Multiple Frontings		2016	muller_consideration-frontings2016
Müller-2017-german_clause_structure_an	Müller, Stefan		German Clause Structure: An Analysis with Special Consideration of So-Called Multiple Fronting		2017	muller_consideration-fronting2017
Müller-2017-redundancy_effects_in_discourse	Müller, Sonja		Redundancy effects in discourse: On the modal particle combinations halt eben and eben halt in German		2017	muller_halt-eben2017
Müller-2019-german_a_grammatical_sketch	Stefan Müller		German: A Grammatical Sketch		2019	muller_german-sketch2019
Müller-2021-german_clause_structure_an	Müller, Stefan		German Clause Structure: An Analysis with Special Consideration of So-Called Multiple Fronting		2021	muller_consideration-fronting2021
Müller-2023-german_clause_structure_an	Müller, Stefan		German Clause Structure: An Analysis with Special Consideration of So-Called Multiple Fronting		2023	muller_consideration-fronting2023
Neef-1998-a_case_study_in	Neef, Martin		A case study in declarative morphology: German case inflection		1998	neef_declarative-inflection1998
Neef-2005-the_relation_of_vowel	Neef, Martin		The relation of vowel letters to phonological syllables in English and German		2005	neef_letters-syllables2005
Nekvapil-2000-on_nonselfevident_relationships_between	Nekvapil, Jiří		On non-self-evident relationships between language and ethnicity: How Germans do not speak German, and Czechs do not speak Czech		2000	nekvapil_evident-czechs2000
Nerbonne-1986-a_phrasestructure_grammar_for	Nerbonne, John		A phrase-structure grammar for German passives		1986	nerbonne_phrase-passives1986
Nerbonne-1994-german_in_headdriven_phrase	Nerbonne, John and Netter, Klaus and Pollard, Carl		German in Head-Driven Phrase Structure Grammar		1994	nerbonne-netter-pollard_head-driven1994
Netter-1991-clause_union_phenomena_and	Netter, Klaus		Clause Union Phenomena and Complex Predicates in German		1991	netter_union-phenomena1991
Neumann-1996-the_dative_and_the	Neumann, Dorothea		The dative and the grammar of body parts in German		1996	neumann_dative-parts1996
Neumann-2004-the_conventionalization_of_the	Neumann, Ragnhild and Müller, Cornelia and Posner, Roland		The conventionalization of the ring gesture in German discourse		2004	muller-neumann-posner_conventionalization-ring2004
Nielsen-2015-the_vowel_systems_of	Nielsen, Hans Frede		The Vowel Systems of Old English, Old Norse and Old High German Compared		2015	nielsen_norse-compared2015
Niemann-2015-effects_of_phrasal_position	Niemann, Henrik and Mücke, Doris		Effects of phrasal position and metrical structure on alignment patterns of nuclear pitch accents in German: Acoustics and articulation		2015	mucke-niemann_nuclear-acoustics2015
Niemeier-2008-making_progress_simpler_applying	Niemeier, Susanne and Reif, Monika		Making progress simpler? Applying cognitive grammar to tense-aspect teaching in the German EFL classroom		2008	niemeier-reif_simpler-applying2008
Noehden-1800-german_grammar_adapted_to	Noehden, George Henry		German Grammar Adapted to the Use of Englishmen		1800	noehden_adapted-englishmen1800
Noelliste-2017-the_phonology_of_sonorants	Noelliste, Erin		The phonology of sonorants in Bavarian German		2017	noelliste_sonorants-bavarian2017
O'Brien-2016-german_phonetics_and_phonology	O'Brien, Mary Grantham and Fagan, Sarah M. B.		German phonetics and phonology. Theory and practice		2016	fagan-obrien_phonetics-practice2016
Olsen-1989-agreement_in_the_german	Olsen, Susan and Bhatt, Christa and Löbel, Elisabeth and Schmidt, Claudia	Olsen, Susan // Olsen, Susan and Bhatt, Christa and Löbel, Elisabeth and Schmidt, Claudia	AGR(eement) in the German noun phrase	AGR(eement) in the German Noun Phrase // AGR(eement) in the German noun phrase	1989	bhatt-lobel-olsen-schmidt_agr-eement1989 olsen_agr-eement1989
Osborne-2006-shared_material_and_grammar	Osborne, Timothy		Shared Material and Grammar: Toward A Dependency Grammar Theory of Non-Gapping Coordination for English and German		2006	osborne_shared-gapping2006
Otto-1864-german_grammar_combined_with	Otto, Emil		German grammar combined with conversational exercises. A new and practical method of learning the German language		1864	otto_combined-exercises1864
Ozolin-1935-latviskivaciska_un_vaciskilatviska_vardnica	Ozolin, Ed. and Endzelin, J.		Latviski-vaciska un vaciski-latviska vardnica Lettisch-deutsches und deutsch-lettisches Wörterbuch		1935	endzelin-ozolin_vaciska-vaciski1935
Palmer-1950-the_influence_of_english	Palmer, Philip Motley		The influence of English on the German vocabulary to 1700		1950	palmer_influence-vocabulary1950
Pam-1979-problems_in_the_description	Pam, Martin D.		Problems in the description of german word order		1979	pam_problems-order1979
Pankau-2013-replacing_copies_the_syntax	Pankau, Andreas		Replacing copies: The syntax of wh-copying in German		2013	pankau_replacing-copies2013
Pankau-2014-replacing_copies_the_syntax	Pankau, Andreas		Replacing copies: The syntax of wh-copying in German		2014	pankau_replacing-copies2014
Pankau-2018-the_structure_of_approximative	Pankau, Andreas		The structure of approximative numerals in German		2018	pankau_approximative-numerals2018
Paraschkewow-2006-auf_der_spur_der	Paraschkewow, Boris		Auf der Spur der westgermanischen phonematischen Substitute /χt/ und /ft/ im Deutschen / Tracing the West Germanic phonemic substitutes /χt/ und /ft/ in German		2006	paraschkewow_phonematischen-kht2006
Park-1981-the_development_of_syntax	Park, Tschang-Zin		The development of syntax in the child with special reference to German		1981	park_child-special1981
Pecht-2021-language_contact_in_a	Nantke Pecht		Language Contact in a Mining Community: A study of variation in personal pronouns and progressive aspect in Cité Duits		2021	pecht_cite-duits2021
Penke-2004-regular_and_irregular_inflectional	Penke, Martina and Krause-Burmester, Marion		Regular and irregular inflectional morphology in German Williams syndrome		2004	krause-burmester-penke_regular-irregular2004
Penner-1991-main_clause_phenomena_in	Penner, Zvi and Bader, Thomas		Main Clause Phenomena In Embedded Clauses: The Licensing Of Embedded V2-Clauses In Bernese Swiss German		1991	bader-penner_bernese-swiss1991
Penner-1995-issues_in_the_syntax	Penner, Zvi and Bader, Thomas		Issues in the Syntax of Subordination: A Comparative Study of the Complementizer System in Germanic, Romance, and Semitic Languages with Special Reference to Bernese Swiss German		1995	bader-penner_bernese-swiss1995
Peters-2018-phonological_and_semantic_aspects	Peters, Jörg		Phonological and semantic aspects of German intonation		2018	peters_semantic-intonation2018
Petrova-2009-information_structure_and_word	Petrova, Svetlana		Information structure and word order variation in the Old High German Tatian		2009	petrova_high-tatian2009
Petrova-2011-modeling_word_order_variation	Petrova, Svetlana		Modeling word order variation in discourse: On the pragmatic properties of VS order in Old High German		2011	petrova_modeling-high2011
Petrova-2018-discourse_prominence_and_the	Petrova, Svetlana		Discourse prominence and the selection of anaphora – evidence from pronouns in historical German		2018	petrova_prominence-anaphora2018
Peyer-2010-the_multilingual_reader_advantages	Peyer, Elisabeth and Kaiser, Irmtraud and Berthele, Raphael		The multilingual reader: Advantages in understanding and decoding German sentence structure when reading German as an L3		2010	berthele-kaiser-peyer_advantages-decoding2010
